acronym,expansion,anchor_sentence
OP,UNSURED SENSE,"Scaled scores between 9 and 11 ar4e considered average. _%#NAME#%_'s ability to recall verbal information presented in the context of short stories was age-appropriate, both immediately (SS = 11) and after a longer delay (SS = 11). His ability to learn a discreet word list (16 words) over 4 consecutive trials was also average. After immediate exposure (SS = 9) and again after a longer delay (SS = 9). _%#NAME#%_'s visual memory skills were assessed using a subtest entitled Picture Memory, in which he was shown pictures of everyday scenes and then shown a similar picture and asked to mark any changes between the pictures."
C&S,protein C and protein S,5. Cerebrovascular accident with left hemiplegia and dysphagia. She has a feeding tube. 6. History of atrial fibrillation and deep venous thrombosis on Coumadin therapy for a hypercoagulable state with a protein C&S deficiency per her old record. 7. Thalamic hemorrhage stroke. She was seen in Mayo Clinic at that time at St. Mary's Hospital. 8. History of peptic ulcer bleeding. 9. Diabetes mellitus.
C&S,conjunctivae and sclerae,"REVIEW OF SYSTEMS: GI as noted. Otherwise noncontributory. PHYSICAL EXAMINATION: A thin elderly white female in no acute distress. VITAL SIGNS: Stable. HEENT: C&S clear. Oropharynx benign. NECK: Without masses or adenopathy. Healed surgical scars. LUNGS: Clear to A&P. CARDIAC: Regular with no murmurs, rubs, or gallops."
C&S,carcinosarcoma:CaS,"CHIEF COMPLAINT: A _%#1914#%_ woman comes to the ER complaining of increasing shortness of breath, fatigue and lower extremity weakness. PAST MEDICAL HISTORY: Significant for: 1. Recently diagnosed ovarian C&S, please see HPI. She underwent a debulking procedure in _%#MM#%_. 2. History of stomach cancer status post gastrectomy and partial colectomy in 1967."
C&S,central nervous system:CNS,"EEG will be obtained looking for any evidence of underlying seizure activity. If these measures are not revealing and he does not improve, then a spinal tap would be indicated to evaluate possibility of C&S infection. Thank you very much for allowing us to participate in the care and evaluation of this very interesting gentleman."
C&S,culture and sensitivity,"Will follow with serial troponins. An echocardiogram will be ordered accordingly and also receive Tylenol p.r.n. As for his gastroesophageal reflux disease, he will receive Zantac 75 mg p.o. daily. Fasting lipids as well as UA with micro and C&S has been ordered as well. Also, I will obtain a CMP, TSH, magnesium and phosphorous level. If the patient remains stable clinically, he can be discharged home and an outpatient stress test will continue ordered for him accordingly."
PDA,patient-controlled analgesia:PCA,"At this point and time, please see orders for details. We will place her on Rocephin 2 gm every 12 hours until cultures are back as well as Solu- Medrol. PAC pump for anesthesia. Tylenol as needed. Nicoderm patch for smoking. Heating pad for comfort. Trazodone for sleep. Celexa for anxiety."
PDA,patent ductus arteriosus,"Problem #6: Hypotension. In order to maintain his systemic blood pressure and improve peripheral perfusion, _%#NAME#%_ required treatment with hydrocortisone. However, the hydrocortisone was stopped on _%#DDMM2007#%_ when he was started on neoprofen. After his PDA was ligated, he was restarted on hydrocortisone for a total of 3 additional days. Due to issues of persistent hypotension, he was restarted on IV steroids with hydrocortisone on _%#DDMM2008#%_."
PDA,posterior descending artery,"He was noted to have a diagonal 1 90% lesion, 40% narrowing in his ramus, mild luminal irregularities in his circumflex no greater than 20%, PDA 60% narrowing, 80% blockage at the posterolateral branch. LV-gram was not performed. He therefore underwent stenting of a 2.75 x 33 mm and 2.5 x 13 mm drug-eluting stent to his mid-LAD long calcified area re-establishing good flow with 0% residual stenosis."
C4,cluster of differentiation 4:CD4,"The results of the transplant renal biopsy was negative for any evidence of acute or chronic rejection, was mildly positive for a C4 positive, otherwise unremarkable. On postop day 14, patient's creatinine continued to actually improve below 2.5. In subsequent hospital days, his creatinine trended down to at the best postop level of 2.18 with good urine output."
C4,(complement) component 4,"Her CD3 which was 96, CD4 16, CD8 79, C- reactive protein 2.7, and ESR 120. Neutrophil and cytoplasmic IgG were normal. Antinuclear antibody screening was weakly positive. Complement C4 11, complement C3 44, rheumatoid factor 97, hepatitis A negative, hepatitis B negative, hepatitis C negative, LDH 667, CMV IgG antibody was positive, and influenza was negative."
C4,cervical (level) 4,"HISTORY OF PRESENT ILLNESS: Ms. _%#NAME#%_ _%#NAME#%_ is an 83-year-old right-handed woman who is postoperative day #2 for a 2-level ACDF cervical surgery secondary to severe cervical stenosis. She had decompression and fusion of the cervical spine from C4 through C5 and C5 through C6. She had worsening hyporeflexia and gait instability for the last month. She came in for this elective surgery, which was performed under general anesthesia."
C4,(PO Box) C4,"In conclusion, the patient is a 60-year-old gentleman who has symptomatic diskogenic disease, who will be a surgical candidate under the care of Dr. _%#NAME#%_. _%#NAME#%_ _%#NAME#%_, MD _%#ADDRESS#%_ _%#ADDRESS#%_ _%#STREET#%_ _%#STREET#%_ _%#STREET#%_ _%#CITY#%_, MN _%#55400#%_"
C4,fourth heart sound:S4,"Neck supple; no jugular venous distention; no thyromegaly. Lungs: Bilateral rales and rhonchi heard diffusely heard over both lungs fields. Heart: Both heart sounds are audible; no S2, C4; no murmurs or gallops. Abdomen: Slightly distended; no rebound tenderness; no guarding; no rigidity. Scars of old surgery are benign. Extremities: The patient has bilateral lower extremity edema left greater than right."
CDI,"clean, dry, intact","PHYSICAL EXAMINATION ON DISCHARGE: She is alert and oriented, in no apparent distress, non ill-appearing. Cranial nerves 2-12 are grossly intact. Her incisions, as mentioned above, are CDI. She is not complaining of any pain or other symptoms of discomfort, nausea, vomiting, dyspnea. DISCHARGE PLANNING: She is to follow with Dr. _%#NAME#%_ on _%#MM#%_ _%#DD#%_, 2005, for nasal packing removal."
CDI,center for diagnostic imaging,"PAST MEDICAL HISTORY: Negative. REVIEW OF SYSTEMS: Head, eyes, ears, nose, throat, heart, lung, abdomen, neuro, musculoskeletal, integumentary, extremities otherwise negative. FAMILY HISTORY: Maternal grandfather with colon cancer. SOCIAL HISTORY: She works full time as a tech for CDI and also starting x-ray school on _%#MMDD2004#%_. PHYSICAL EXAMINATION: GENERAL: A pleasant female in no acute distress."
CDI,UNSURED SENSE,"Scaled scores between 9 and 11 ar4e considered average. _%#NAME#%_'s ability to recall verbal information presented in the context of short stories was age-appropriate, both immediately (SS = 11) and after a longer delay (SS = 11). His ability to learn a discreet word list (16 words) over 4 consecutive trials was also average. After immediate exposure (SS = 9) and again after a longer delay (SS = 9). _%#NAME#%_'s visual memory skills were assessed using a subtest entitled Picture Memory, in which he was shown pictures of everyday scenes and then shown a similar picture and asked to mark any changes between the pictures."
CDI,Children's Depression Inventory,"_%#NAME#%_ reported that his mother was a t eenager when he was born. TESTS ADMINISTERED: Wechsler Intelligence Scale for Children - Fourth Edition (WISC-IV), Wechsler Individual Achievement Test - Second Edition (WAIT-II)selected subtests, The Trail Making Test, parts A and B, Controlled Word Association Test (CWAT), The Connor's Continuous Performance Test - Second Edition (CPT II), , Wisconsin Card Sorting Test (WCST), Rey Complex Figure Test (RCFT), Child Depression Inventory (CDI), Revised Children's Manifest Anxiety Scale (RCMAS), Sentence Completion Test (SCT), clinical interview, parent interview and review of previous hospital records."
DC,(drug) DC,"The patient should have a chest x-ray at the time of his followup with Dr. _%#NAME#%_ and Dr. _%#NAME#%_. MEDICATIONS AT THE TIME OF DISCHARGE: 1. Bactrim DC 1 tab p.o. b.i.d., Monday and Tuesday. 2. Zofran 8 mg p.o. q.6 h. p.r.n. nausea. 3. Peridex 1.5 mL swish and spit b.i.d."
DC,discontinue,"She is also discharged on Ringer's lactate IV at 75 cc/hr, which is a continuous infusion for 2 weeks. FOLLOW UP: 1. Instructions were given for DC IV fluids in 2 weeks and DC PICC line in 3 weeks. 2. She is asked to follow with her Southside Community Clinic for her OB visit in 1 week."
DC,District of Columbia,"If he did, it must have been a very small branch vessel, as it did not affect his electrocardiogram or echocardiogram. Discharge follow-up will be in _%#CITY#%_, _%#CITY#%_ with his family doctor. He will be leaving for _%#CITY#%_, _%#CITY#%_ pretty soon. DISCHARGE MEDICATIONS: 1. Toprol XL 25 mg p.o. once a day. 2. Aspirin 325 mg p.o. once a day."
DC,deceased donor:DD,3. Peripheral neuropathy. 4. Hypertension. 5. End-stage renal disease secondary to diabetic nephropathy. 6. Hyperthyroidism. 7. Osteoporosis. 8. History of detached retina. 9. DC stoner pancreas transplant with enteric drainage _%#MMDD#%_. 10. Status post bilateral retinal photocoagulation. 11. Status post bilateral retinal repair. 12. Status post bilateral foot surgery.
DC,direct and consensual,Her neck is supple. There are no carotid bruits. Her fundi are benign with intact visual fields to confrontation. Her pupils are equal and reactive to light DC. Eye movements are full without nystagmus. Her face appears symmetrical with equal sensation and motion bilaterally. Hearing is intact on bedside observation. Her palate and uvula elevate in the midline.
DC,discharge,"7. Bactrim DS one tab p.o. b.i.d. x5 days. 8. OxyFAST 2.5 to 5 mg p.o. q.6h. p.r.n. DISPOSITION: 1. The patient will follow up with TCU MD upon arrival. 2. She will follow up with her PMD, Dr. _%#NAME#%_, upon DC from rehab. 3. BNP, TSH, free T4 will be rechecked in one week with results to TCU MD or patient's care MD for follow-up."
DC,(diltiazem) DC,"At one point, the patient had E. coli sepsis which was treated with intravenous antibiotics. The patient ultimately improved the point where we could transfer her to a nursing facility. DISCHARGE MEDICATIONS: 1. Atenolol 25 mg daily for blood pressure. 2. Diltiazem DC 180b mg daily for blood pressure. 3. Lexapro 20 mg daily for depression. 4. Lorazepam 0.5 mg t.i.d. p.r.n. for anxiety."
DC,direct current,"The patient had coronary angiography on _%#MM#%_ _%#DD#%_, 2003, which revealed normal coronaries. The patient gives a history of ablation of atrial flutter in 2000 and he also gives a history of DC cardioversion of his episodes of atrial fibrillation, which have not been successful. The patient has been on chronic amiodarone. The patient was admitted to the hospital for ablation of atrial fibrillation."
PD,prism diopter,"On muscle balance testing in primary gaze at distance, I measured a 4 PD esotropia combined with a 3 PD right hypotropia. At near we measured a 5 PD esotropia. Her slit lamp examination was normal as was her funduscopic examination. Cycloplegic retinoscopy was +1.00 +2.50 x 120 in the right eye and +2.75 + 1.50 x 43 on the left."
PD,pancreatic duct,"The common bile duct was freely cannulated and was slightly dilated at 10 to 12 mm. There were no definite stones. Sphincterotomy and two balloon sweeps were done with no stones identified. The PD was not entered. On the day of discharge, his total bilirubin had fallen to 2.5, ALT 140, AST 51. He felt well, was eating OK and denied abdominal pain."
PD,dorsalis pedis:DP,"ABDOMEN: Soft, nontender, nondistended, normal active bowel sounds. Liver percusses to the costal margin. Spleen not palpable. EXTREMITIES: Warm, no cyanosis, clubbing or edema. 2 DT pulses bilaterally. LABORATORY DATA: Pending. IMAGING: Chest x-ray pending."
PD,Parkinson disease,"DISCHARGE DIAGNOSES: 1. Bilateral lower extremity contracture and rigidity, most likely secondary to Parkinson disease. 2. Left upper extremity contracture, most likely secondary to Parkinson disease. 3. Hallucinations related to PD and/or medications Discharged to home. HISTORY OF PRESENT ILLNESS: Ms. _%#NAME#%_ is a 74-year-old right-handed female with a diagnosis of Parkinson disease since 2005."
PD,patent ductus,"1. Small for gestational age, intubated after delivery secondary to respiratory distress, had multiple dysmorphic features noted at birth. 2. History of TE fistula status post repair and esophageal atresia, status post repair with PD ligation in _%#DDMM2000#%_. 3. Choanal atresia repair, Nissen and G-tube placement in _%#DDMM2000#%_. 4. Status post cleft lip and palate repair in _%#DDMM2000#%_."
PD,(device) PD,"7. Doxycycline 100 mg p.o. b.i.d. 8. Vitamin K 5 mg p.o. every week. 9. Multivitamins 1 tablet p.o. q.d. 10. Vitamin ADEKs 2 tablets p.o. q.d. 11. Albuterol MDI 2 puffs p.r.n. 12. PD vest b.i.d. SOCIAL HISTORY: No tobacco, quit alcohol _%#DDMM2001#%_, and no IV drug use."
PD,phosphate dehydrogenase,"3. Maintenance intravenous fluids if can obtain intravenous access 4. Breast feed and formula feed ad lib 5. Intake and output 6. Daily weights 7. Check bili, CBC, reticulocyte, peripheral smear and G6 PD deficiency with 1600 labs 8. Recheck bili in the a.m. 9. Await All About Children's rounder in the a.m."
PD,police department,"She denies hearing the phone every ringing. Upon arrival of the PD and paramedics, they noted that the house smelled strongly of urine and stool. The PD felt that the house was unsuitable for living had had contacted environmental services. They had found that the patient had been urinating in milk cartons and had been using bowel movements in a crock pot as her toilet was not functioning appropriately."
PD,peritoneal dialysis,HISTORY OF PRESENT ILLNESS: _%#NAME#%_ is a now 26-month-old male who was admitted to the hospital initially with a bloody emesis and subsequently found to have hepatorenal dysplasia of unknown etiology. His end-stage renal disease was PD dependent and was transferred to HD and also has chronic lung disease and is ventilator dependent with the tracheostomy.
PD,personality disorder,"6. Suspected CVA (1996) with slurred speech, TIA (left-sided hemiparesis) _%#DDMM2007#%_. 7. Acute head injury on 2 occasions: 2005 and another unknown date. 8. Psychiatric history (GAD, PTSD, PD, ADHD, personality disorder NOS, major depressive disorder, meth dependency, borderline personality disorder, and antisocial personality disorder). PAST SURGICAL HISTORY: 1. Hysterectomy. 2. Nephrectomy (left). 3. Gastrectomy (secondary to gastric ulcers)."
PD,pulmonary embolus:PE,"Neurologic exam is unremarkable. LABS: Sodium 133; chloride 91; potassium 4.4; bicarb 34; BUN 14; creatinine 0.6; anion gap 8; platelets 222; white blood cell count 11.9 with 76% neutrophils; hemoglobin 13.8; platelets 247, D-dimer 0.7; troponin less than 0.7. Brain natriuretic peptide is 69. Glucose is 150. Electrocardiogram shows no fast rhythm. No ischemic changes. CT of chest is negative for PD. It does show a couple of small mid-mediastinal nodes. IMPRESSIONS: 1. Dyspnea with hypoxia. No acute cause found in the emergency department."
PD,(drug) PD,5. Amitriptyline 10 HS 6. She is taking hydrocodone APAP 5/500 one tablet every 4-6 hours as needed for pain. 7. She is on some Guaifed PD. 8. She has been on Xenical 120 t.i.d. 9. Multivitamins ALLERGIES: Sulfa drugs. Smoking history - none. Alcohol use - none.
PD,posterior descending,"Coronary angiogram showed proximal LAD stenosis, large obtuse marginal severe stenosis, and severe stenosis in the PD of the right coronary artery. Left ventricular and diastolic pressure was 10 mm of mercury. She had internal mammary to the diagonal of the LAD, vein graft to the PDA of the right coronary artery and a vein graft to the ramus circumflex artery."
PD,purified protein derivative:PPD,"2. Hypokalemia, mild noted prior to admission. 3. Borderline hypertension noted since admission. I am not aware of a history of hypertension. 4. History of positive PD treated last year. It is not clear if the patient is compliant with a complete course and what type of follow-up he has had for this."
PD,UNSURED SENSE,"Scaled scores between 9 and 11 ar4e considered average. _%#NAME#%_'s ability to recall verbal information presented in the context of short stories was age-appropriate, both immediately (SS = 11) and after a longer delay (SS = 11). His ability to learn a discreet word list (16 words) over 4 consecutive trials was also average. After immediate exposure (SS = 9) and again after a longer delay (SS = 9). _%#NAME#%_'s visual memory skills were assessed using a subtest entitled Picture Memory, in which he was shown pictures of everyday scenes and then shown a similar picture and asked to mark any changes between the pictures."
ET,enterocutaneous:EC,"HISTORY OF PRESENT ILLNESS: A 47-year-old African-American female with advanced esophageal cancer which was diagnosed in _%#MM2005#%_ who has had radiation and chemotherapy and subsequently developed dysphagia, has had significant weight loss, and developed an obstruction and an ET fistula. A stent was placed, but evidently there has been some leakage or some dislodging. She also has recently developed a GI bleed and has needed blood replacements."
ET,electrophysiology:EP,Carvedilol will be decreased to 6.25 mg p.o. b.i.d. if his blood pressure systolic is greater than 80 mmHg. His Bi-V ICD will be interrogated. We have asked Dr. _%#NAME#%_ and Dr. _%#NAME#%_ from the ET department to be consulted to review his case. Warfarin will be regulated through the pharmacy department. He may need dobutamine infusion.
ET,elective termination,"PAST MEDICAL HISTORY: Notable for depression, endometriosis, trace mitral regurgitation, and a family history of breast cancer. PAST SURGICAL HISTORY: Cholecystectomy, hysterectomy, tubal ligation, oophorectomy, hernia repair, left distal radial open reduction internal fixation and ET (elective termination of pregnancy). MEDICATIONS: 1. Premarin 0.9 mg a day. 2. Multivitamin"
ET,pressure equalization:PE,"PAST MEDICAL HISTORY: 1. Psychiatric history. This is per Dr. _%#NAME#%_. 2. Status post bilateral ear surgery as a child. The patient had ET tubes placed that tore through his tympanic membrane, and the patient required surgery to repair the damage. The patient has a history of hearing loss. 3. Status post car accident in _%#MM200_#%_."
ET,electroconvulsive therapy:ECT,"She is compliant with medication. She has had symptoms of increasing despondency with a self-inflicted cigarette burn of the volar aspect of her left forearm, in addition to self-cutting with a ""used razor"" approximately four nights ago. She was evaluated in the emergency department at _%#CITY#%_ _%#CITY#%_; gaping wound left forearm, not sutured, discharged home. Last ET _%#MMDD2002#%_. She denies other active self-harm. There is a remote history of drug overdose x 3 during the patient's teens. She has never received ECT. No problems with general anesthesia except that the patient awakened after jaw surgery in 1977 in the ICU; cannot recollect details."
ET,enterostomal therapy,"5. Risk for osteomyelitis given the pressure sores on the bottom of the right foot. PLANS: We will consult with the ET nurse for wound care orders, and we will consult with Infectious Disease. She will be treated for now with intravenous vancomycin, and we will check into the possibility of ongoing outpatient care with IV vancomycin."
ET,endotracheal,"VITAL SIGNS: Blood pressure is 87/70, heart rate currently 120 and irregular. HEENT: Notable for a nasogastric tube in place and ET tube in place. Pupils are equal, round and reactive to light and accommodation. Oropharynx is clear. NECK: Supple. No trauma. CHEST: Has diffuse crackles on the right, bilateral wheezing."
ET,UNSURED SENSE,"Scaled scores between 9 and 11 ar4e considered average. _%#NAME#%_'s ability to recall verbal information presented in the context of short stories was age-appropriate, both immediately (SS = 11) and after a longer delay (SS = 11). His ability to learn a discreet word list (16 words) over 4 consecutive trials was also average. After immediate exposure (SS = 9) and again after a longer delay (SS = 9). _%#NAME#%_'s visual memory skills were assessed using a subtest entitled Picture Memory, in which he was shown pictures of everyday scenes and then shown a similar picture and asked to mark any changes between the pictures."
SBP,systolic blood pressure,"2. Hypertension. 3. Dyslipidemia. DISCHARGE MEDICATIONS - UNCHANGED: 1. Alprazolam 0.5 mg p.o. each day at bed-time p.r.n. 2. BuSpar 10 mg p.o. daily 3. Hydrochlorothiazide 25 mg p.o. daily 4. Lisinopril 10 mg p.o. daily, hold if SBP is less than 90 5. Multivitamins with minerals p.o. daily 6. Simvastatin 80 mg p.o. q p.m. 7. Aspirin 81 mg p.o. daily 8. Ibuprofen 600 mg p.o. q.i.d. p.r.n. pain"
SBP,spontaneous bacterial peritonitis,"COURSE IN THE HOSPITAL: 1. End-stage liver disease. As mentioned above, he is high on the transplant list and we did get liver transplant team to assess him as an inpatient. The only medication change they suggested is to change his prophylactic SBP antibiotics from Levaquin to Bactrim. We will also continue his other GI medication upon discharge. Although Nh3 is 119 he is fully lucid. 2. Small bowel obstruction."
OTC,ornithine transcarbamoylase,"LABORATORY: Admission labs were pertinent for an ammonia of 300, phos of 2.5, a UPT that was negative, and a UA that was negative. HOSPITAL COURSE: 1. OTC Deficiency: With her acute hyperammonia status, she was made NPO and started on one and half times maintenance of fluid with sugar substrate and other IV substrate including IV Ammonul."
OTC,over the counter,"While driving back to work, he noticed a squeezing pain in his left chest associated with tingling going down the left arm. He thought it may be reflux, but it did not respond to OTC gastroesophageal reflux disease medications. In retrospect, he noted similar symptoms for the past 1 to 2 weeks with less intensity. ALLERGIES: No known drug allergies. SOCIAL HISTORY: No tobacco, social alcohol use."
GT,gutta,"4. Vitamin E 400 Int'l units every other day. 5. The eye drops that were prescribed post cataract surgery, Tobradex 1 GT to left eye qid and Acular 0.5% 1 GT to left eye qid. DISCHARGE FOLLOW-UP: Is to be with Dr. _%#NAME#%_ _%#NAME#%_ either on _%#MMDD2002#%_ or _%#MMDD2002#%_ for a CBC with differential and platelets."
GT,gastrostomy tube,"* Anemia: _%#NAME#%_ is being discharged on Ferrous Sulfate * Constipation: _%#NAME#%_ was discharged on pear juice And glycerin suppositories prn. Recent Labs: * Sodium (_%#MMDD#%_): 142 * Potassium (_%#MMDD#%_): 5.1 * Chloride (_%#MMDD#%_): 105 * BUN (_%#MMDD#%_): 22 * Glc (_%#MMDD#%_): 90 * Ca (_%#MMDD#%_): 9.5 * Mg (_%#MMDD#%_): 2.4 * Phos (_%#MMDD#%_): 4.7 * TSH: (_%#MMDD#%_)3.20 * Free Thyroxine (_%#MMDD#%_): 1.51 * Hg (_%#MMDD#%_): 12.3 * Platelets (_%#MMDD#%_): 343 * Prealbumin (_%#MMDD#%_): 8 Discharge medications, treatments and special equipment: * Captopril GT 0.2mg q8h * Diuril 40mg GT bid * Spironolactone 4mg GT bid * Potassium Chloride 1.5mEq GT q12h * Sodium Chloride 9 mEq GT q6h * Levothyroxine 12.5mcg GT every other day, 25mcg GT every other day * Acetaminophen 40mg GT q6h prn pain * Glycerin 0.5 PR prn constipation * Ferrous Sulfate 10mg GT qDay * Amoxicillin 125mg GT qDay * Fluticasone 110 micrograms inhaled bid * Atrovent HFA 2puffs inhaled q4h prn respiratory distress Transfer measurements and exam: Weight 4190g (<3%), Length 49.5 (<3%), OFC 36 cm (<3%)."
GT,glucose tolerance,"She presented the morning of admission with ruptured membranes but was not in labor. Her pregnancy had been essentially uncomplicated. Prenatal labs include blood type A+, antibody negative, hemoglobin 12.8, RPR non-reactive, hepatitis surface antigen non-reactive, Rubella immune, HIV non-reactive, Glucola equal to 149 with a normal three hour GT. PAST MEDICAL HISTORY: History of cholecystectomy in 2003. MEDICATIONS: Prenatal vitamins."
GT,gamma-glutamyltransferase:GGT,"LABORATORY DATA: From Regions Hospital showed a basic metabolic panel within normal limits. Urine tox is negative. ALT 9, AST 18, total bilirubin 0.3, total cholesterol 194, CK 35, GT 30, magnesium 1.9, phosphorus 2.8. TSH 1.03. Hemoglobin 11.6 with a hematocrit 34.3, otherwise within normal limits. Recheck of hemoglobin on _%#MMDD2006#%_ was 12.1. ASSESSMENT: 1. Alcohol detox."
GT,glutamyl transpeptidase,"On _%#MMDD2007#%_, Hemoglobin A1C was 7.6, TSH less than 0.03, Free T4 was 2.2 which was mildly elevated. T3 level was 93 which is normal. Cortisol 21.7. Hepatitis C antibody was negative. Gamma GT 21. ALT 31. AST 42. Alkaline phosphatase 62. ADDENDUM : Discharged today but januvia too expensive changed to amaryl."
GT,guttae:GGT,"4. Atrial fibrillation. As mentioned in the H and P, the patient's hospital course at the outside hospital was complicated by multiple episodes of paroxysmal atrial fibrillation. All of these episodes were responded to cardioversion and the patient was started on amiodarone GT T. During the initial hospitalization at UMMC, his hospital course was complicated by an episode of atrial fibrillation which was successfully cardioverted."
VBG,vertical banded gastroplasty,DIAGNOSIS: Upper gastrointestinal bleed. HISTORY OF PRESENT ILLNESS: Ms. _%#NAME#%_ _%#NAME#%_ is a 48-year-old female underwent revision of her VBG to Roux-en-Y GB on _%#MMDD2007#%_. The patient states that she has had black tarry formed stools since her operation. One day prior to presentation she began to have diarrhea with bright red blood mixed in her stools.
