acronym,expansion,anchor_sentence
VBG,venous blood gas,"Had gasping respirations at 30 minutes of age. He was transferred to the SCN at Southdale Hospital and placed on a ventilator with rate 60, PIP 24, EEP 4, and 100% FiO2. His initial VBG was 6.90/63/57/12. He was maintained on mechanical ventilation during transport and throughout his NICU stay. 2. Cardiovascular - FHTs before delivery were noted to be in the 60s."
MR,magnetic resonance,2. Hyperlipidemia. 3. Acid reflux disease. 4. Status post right total knee arthroplasty in 2001. DISCHARGE PLANS: 1. Repeat MRI brain and MR angiogram of circle of Willis on _%#MMDD2005#%_ at Fairview Southdale Hospital. 2. Follow up with Dr. _%#NAME#%_ _%#MMDD2005#%_. 3. Follow up at primary-care clinic in about two weeks
MR,medical record,The history was obtained primarily from wife and from the medical record as the patient was not able to give history at the time of admission. Review of the MR indicated at the time of admission that the patient had chronic kidney disease and since _%#MM2006#%_ the renal function had been getting worse.
MR,GENERAL ENGLISH,"Conversely he has continued to use all the way up until 3 months, when he was abusing opiates. He also has had a history of passive-aggressive and forceful type behaviors. IT should be noted though that his father has a history of alcoholism and continues to drink on a daily basis. Overall, he feels that he was emotionally abused by his father."
MR,mitral regurgitation,"They did not find this very concerning and recommended consideration of an outpatient stress test and outpatient Holter monitor. Additionally, they recommended starting digoxin to control symptoms. Cardiac echo obtained during the hospital course showed a normal ejection fraction, mild LVH, moderate LAE, moderate MR, moderate RVE, moderate RAE, moderate TR, moderate increased right ventricular systolic pressure. PROBLEM #3: Chronic change right lung base on CT scan."
MR,myocardial infarction:MI,On the day of admission he had severe chest pressure which quite frightened him and brought him here. He ruled out for an MR. His initial cardiac echo was normal and his EKG was normal. He did have a couple of very mild episodes of his chest pressure.
MR,mental retardation,"The patient was admitted for the evaluation of escalating behavior concerns. She has a significant psychiatric history, which includes pervasive developmental disorder, ADHD, mild MR, fetal alcohol spectrum. She has been hospitalized here on several occasions for similar concerns. The patient denies acute physical concerns. She does have a history of pulmonary stenosis and recently had an echocardiogram done to evaluate this, in view of history of intermittent left lower extremity edema."
DM,NAME,CHIEF COMPLAINT: Fever. HISTORY OF PRESENT ILLNESS: _%#NAME#%_ _%#NAME#%_ is a _%#1914#%_ male recently discharged from Southdale Hospital with urosepsis to _%#CITY#%_ Care Center. This morning was getting up to the bathroom trying to walk without his walker; he fell and bumped his head at that time.
DM,dextromethorphan,6. Lisinopril 20 mg p.o. daily. 7. Protonix 40 mg p.o. daily. 8. Albuterol MDI 2 puffs q. 4 hours p.r.n. shortness of breath. 9. Doxepin 25 mg p.o. q. h.s. 10. Robitussin DM 10 mL p.o. q. 4 hours p.r.n. cough. 11. Advair 1 puff b.i.d. 12. Combivent 2 puffs q.i.d. HISTORY OF PRESENT ILLNESS: The patient is an 85-year-old male who came in with worsening cough.
DM,medical doctor:MD,"Primary care physician: _%#NAME#%_ _%#NAME#%_, MD - Allina Medical Clinic, _%#CITY#%_ Oncologist: _%#NAME#%_ _%#NAME#%_, DM - Mayo Clinic CHIEF COMPLAINT: Shortness of breath. HISTORY OF PRESENT ILLNESS: All of the history is obtained from Mrs. _%#NAME#%_ _%#NAME#%_'s children who are present at the hospital at this time."
DM,diabetes mellitus,"The patient was started on neoadjuvant chemotherapy and completed 2 cycles of ifosfamide to Adriamycin on _%#MM#%_ _%#DD#%_, 2003. CT from an outside hospital showed multiple lung nodules, with indeterminate significance. These are type negative. 2. DM, type 2, since the age of 19, well controlled on p.o. meds. 3. Hyperlipidemia. 4. Hypothyroidism. 5. Recurrent vaginal yeast infection. ALLERGIES: Flu shot, Techni-Care scrub."
DM,UNSURED SENSE,"Scaled scores between 9 and 11 ar4e considered average. _%#NAME#%_'s ability to recall verbal information presented in the context of short stories was age-appropriate, both immediately (SS = 11) and after a longer delay (SS = 11). His ability to learn a discreet word list (16 words) over 4 consecutive trials was also average. After immediate exposure (SS = 9) and again after a longer delay (SS = 9). _%#NAME#%_'s visual memory skills were assessed using a subtest entitled Picture Memory, in which he was shown pictures of everyday scenes and then shown a similar picture and asked to mark any changes between the pictures."
IA,transient ischemic attack:TIA,"10. Status post kidney mass removal in 2003. 11. Status post cholecystectomy in 2003. 12. Status post breast reduction in _%#MM2007#%_. 13. History of T IA, patient states she was previously in rehab for this. ALLERGIES: Penicillin, meperidine, sulfa, Vistaril, Ambien and morphine."
IA,(class) IA,"Very anxious individual. LEG EXAM: As indicated from previous exams with the orthopedic surgeon and with myself. Slowly growing. MANAGEMENT: He is Class IA as a risk. The methotrexate should not be of much concern. We will get liver function tests, CBC, and basic metabolic profile."
IA,UNSURED SENSE,"Scaled scores between 9 and 11 ar4e considered average. _%#NAME#%_'s ability to recall verbal information presented in the context of short stories was age-appropriate, both immediately (SS = 11) and after a longer delay (SS = 11). His ability to learn a discreet word list (16 words) over 4 consecutive trials was also average. After immediate exposure (SS = 9) and again after a longer delay (SS = 9). _%#NAME#%_'s visual memory skills were assessed using a subtest entitled Picture Memory, in which he was shown pictures of everyday scenes and then shown a similar picture and asked to mark any changes between the pictures."
IA,(type) IA,"All of these conditions are what's called recessive inheritance, which means that both parents need to be a carrier in order to have a child that is affected with these conditions. We reviewed cystic fibrosis, Tay-Sachs disease, Canavan disease, familial dysautonomia, Bloom syndrome, Fanconi anemia, group C, Gaucher's disease, glycogen storage disease type IA, maple syrup urine disease, mucolipidosis type IV, and Niemann-Pick disease (type A). If 1 individual is found to be a carrier, then we can certainly screen the other partner."
IA,Iowa,"DISCUSSION: Mr. _%#NAME#%_'s history is already well described. The patient has a lengthy history of cardiac issues and is admitted here with a complaint of chest pain. He was last at this hospital in _%#MM2000#%_ and since then has received medical care from a number of sources apparently mainly through physicians in _%#CITY#%_, IA during 2001 and 2002, more recently he has lived in _%#CITY#%_, MN and has been cared for by primary physicians there as well as visiting cardiology consultants from the Abbott Northwestern group."
IA,(status) IA,"It also showed several long clots of blood. She did have a right heart cath the day prior to developing hemoptysis but the balloon was not inflated in the pulmonary artery, which, otherwise, could have been a contributor to developing hemoptysis. In addition, the patient was intubated in the ICU. Pulmonary consult was obtained. The patient's transplant status was upgraded to IA. She remained intubated and was relatively stable until the morning of _%#MMDD2006#%_. She became hypotensive on the morning of _%#MMDD2006#%_ and was profoundly acidotic."
IA,(grade) IA,"He was seen by primary cardiologist Dr. _%#NAME#%_ on _%#MMDD#%_ and heart muscle biopsy, which revealed no evidence of rejection with inflammatory grade IA. On _%#MMDD#%_, home health care nurse noticed that the patient has tachycardia around 140s. He denied any symptoms including dyspnea, dizziness, lightheadedness or palpitation."
IA,(stage) IA,"Her history dates back to 2003 when she underwent a TAH, BSO, pelvic and periaortic lymphadenectomy at the University of Minnesota for a stage IA adenosarcoma of the uterus. She did well until approximately _%#MM#%_/_%#MM#%_ of this year when she began experiencing abdominal pain and was cared for during this time at Methodist Hospital at the Park Nicollet Cancer Center."
IA,intraarterial,"His puncture site was clean, dry and intact. His intraarterial chemotherapy was carboplatin at 684 mg. IA chemotherapy on day 1 and day 2, IV chemotherapy with Cytoxan and etoposide 564.3 and 342 mg IV respectively. After the procedure, there were no complications. He was ambulating and having good pain control prior to discharge."
BM,bowel movement,"He has had persistent periumbilical pain 6 out of 10 which he rated as sharp. He described it as non-radiating. The patient had not produced over those 2 days any BM or any flatus suggesting an obstructive picture. However, with Gastrografin enema he did produce stool and his constipation symptoms were relieved."
BM,breast milk,He passed the ABR hearing screening test. Immunizations: none given _%#NAME#%_ was discharged on 24Kcal BM fortified with Enfacare on an ALD schedule. The parents were asked to make an appointment for their child to see you within one week.
BM,bone marrow,"2. AMS - workup in progress 3. CMV viremia - treatment with Valcyte started 4. anemia/thrombocytopenia - high LDH and low haptoglobin suggests intravascular hemolysis (ie TTP-HUS) although no evidence on smear, pancytopenia could certainly be explained by active CMV viremia -> BM suppression, follow now but would treat if high clinical suspicion I was present and participated in this evaluation and agree with the fellow's note above."
BM,UNSURED SENSE,"Scaled scores between 9 and 11 ar4e considered average. _%#NAME#%_'s ability to recall verbal information presented in the context of short stories was age-appropriate, both immediately (SS = 11) and after a longer delay (SS = 11). His ability to learn a discreet word list (16 words) over 4 consecutive trials was also average. After immediate exposure (SS = 9) and again after a longer delay (SS = 9). _%#NAME#%_'s visual memory skills were assessed using a subtest entitled Picture Memory, in which he was shown pictures of everyday scenes and then shown a similar picture and asked to mark any changes between the pictures."
LE,NAME,CHIEF COMPLAINT: Fever. HISTORY OF PRESENT ILLNESS: _%#NAME#%_ _%#NAME#%_ is a _%#1914#%_ male recently discharged from Southdale Hospital with urosepsis to _%#CITY#%_ Care Center. This morning was getting up to the bathroom trying to walk without his walker; he fell and bumped his head at that time.
LE,lower extremity,"Will continue lactulose, follow her MS. Her ct showed area of hypodensity, will f/u with MRI. Currently no diffuse abdominal pain, wil check for SBP if she develops this, spikes a fever. 2)LE Edema -- evaluate with US for DVT, o/w will treat with diuretics, although this is likely related to her pulm HTN and cirrhosis."
LE,left ventricle:LV,"CT of the head revealed prior basal ganglia injury, otherwise no acute changes. Bilateral carotid ultrasounds were less than 50%. Echocardiogram revealed mild LE with a normal ejection fraction, grade II diastolic dysfunction. MRI/MRA one week ago apparently noted atrophy only. Dr. _%#NAME#%_ noted that her MRI, 2-D echo and carotids were essentially normal and did note that she had benign positional vertigo versus a questionable TIA type symptoms and she would be well covered on a combination of one baby aspirin per day."
LE,lupus erythematosus,"CV: Negative. Respiratory: Negative. Digestive: Negative. Urinary: Negative. Muscle, bone, and concomitant joint pain and myofacial pain associated with LE flares. Skin: The patient has been experiencing increasing episodes of hives, although not in the most recent exacerbation that led to her admission."
LE,lymphedema,"Lungs were clear to auscultation bilaterally. Abdomen was soft, nontender, nondistended with some mild epigastric tenderness. Extremities were normal with trace LE. She did not have any rashes, and her neurologic exam was grossly intact. LABORATORY: On admission, white count was 11,000, hemoglobin 14.3, platelets 390,000."
LE,long-acting:LA,MEDICATION ALLERGIES: None known. MEDICATIONS PRIOR TO ADMISSION: 1. Depakote ER 500 mg two q.h.s. 2. Metamucil one teaspoon daily. 3. Datril LE 2 mg daily. 4. Provera 10 mg two tablets t.i.d. 5. Oxygen 2 L per nasal cannula while sleeping. 6. Premarin 0.625 mg daily. 7. Synthroid 0.05 mg daily for presumed hypothyroidism.
LE,sinemet-levodopa,"She was discharged on postoperative day 1 after her pulse generator was programmed. DISCHARGE MEDICATIONS: 1. Sinemet LE 25/100 1/4 tablet at 0700 and 1100. 2. Sinemet LE 25/100 1/2 tablet at 1900. 3. Sinemet CR 50/200 1/2 tablet at 0700, 1100, 1900, and 2300."
LE,leukocyte esterase,"INR is 2.84. She has normal LFTs, amylase and lipase. A troponin is less than 0.04. Urinalysis shows small blood, negative nitrate and LE. There is less than 1 WBC and 8 RBCs. Chest x-ray is clear without any focal consolidation."
LE,UNSURED SENSE,"Scaled scores between 9 and 11 ar4e considered average. _%#NAME#%_'s ability to recall verbal information presented in the context of short stories was age-appropriate, both immediately (SS = 11) and after a longer delay (SS = 11). His ability to learn a discreet word list (16 words) over 4 consecutive trials was also average. After immediate exposure (SS = 9) and again after a longer delay (SS = 9). _%#NAME#%_'s visual memory skills were assessed using a subtest entitled Picture Memory, in which he was shown pictures of everyday scenes and then shown a similar picture and asked to mark any changes between the pictures."
US,United States,"3. Prilosec 20 mg daily. 4. Senna 2 tablets at bedtime. SOCIAL HISTORY: Patient does not smoke or drink alcohol. She has been in the U.S. for the last 6 years, and she lives with her grandson. PHYSICAL EXAMINATION: VITAL SIGNS: Temperature 95.7, pulse 79 blood pressure 154/93, and respiratory rate 18."
US,ultrasound,"He managed to avoid hospitalization. We saw him on Monday, the day before yesterday in clinic to discus endoscopic options which was planned to be endoscopic pancreaticogastrostomy by US guidance. We recommended that he repeat a CT scan yesterday, particularly because he looked so poorly and he was in pain and had been losing weight."
US,UNSURED SENSE,"Scaled scores between 9 and 11 ar4e considered average. _%#NAME#%_'s ability to recall verbal information presented in the context of short stories was age-appropriate, both immediately (SS = 11) and after a longer delay (SS = 11). His ability to learn a discreet word list (16 words) over 4 consecutive trials was also average. After immediate exposure (SS = 9) and again after a longer delay (SS = 9). _%#NAME#%_'s visual memory skills were assessed using a subtest entitled Picture Memory, in which he was shown pictures of everyday scenes and then shown a similar picture and asked to mark any changes between the pictures."
US,GENERAL ENGLISH,"Conversely he has continued to use all the way up until 3 months, when he was abusing opiates. He also has had a history of passive-aggressive and forceful type behaviors. IT should be noted though that his father has a history of alcoholism and continues to drink on a daily basis. Overall, he feels that he was emotionally abused by his father."
AMA,antimitochondrial antibody,"PLAN: 1) Increase diuretics. 2) Consider Natrecor. 3) Repeat chest x- ray on Monday to follow up after therapy has been augmented. 4) Consider checking AMA, ESR, ANCA to screen for interstitial lung disease if no better after congestive heart therapy augmentation. HISTORY OF PRESENT ILLNESS: This patient is an 80-year-old male who was admitted on _%#MMDD2004#%_ with one-month history of worsening fatigue and breathlessness with activity."
AMA,advanced maternal age,"DISCHARGE DIAGNOSES: 1. Intrauterine pregnancy at term. 2. Active labor. 3. Status post cesarean section. COMPLICATIONS: Fetal intolerance of labor, AMA, infertility, with artificial insemination. OPERATIONS/PROCEDURES PERFORMED: Primary cesarean section. PRENATAL CARE: Nurse midwives, began at 11 weeks, 9 visits, weight gain was 13 pounds."
AMA,against medical advice,She will sign an AMA form. I will give her Vicodin and Coumadin to take with her as a precaution. She has agreed to sign AMA.
PCP,patient-controlled analgesia:PCA,"At this point and time, please see orders for details. We will place her on Rocephin 2 gm every 12 hours until cultures are back as well as Solu- Medrol. PAC pump for anesthesia. Tylenol as needed. Nicoderm patch for smoking. Heating pad for comfort. Trazodone for sleep. Celexa for anxiety."
PCP,Pneumocystis jiroveci pneumonia,"In regards to her rheumatoid arthritis she is on long-term prednisone, which was continued in the hospital, and she is also on Bactrim for PCP prophylaxis. She then was transferred to rehabilitation. REHABILITATION COURSE: The patient slowly met the goals of physical therapy and occupational therapy."
PCP,primary care physician,"15. Lopressor 25 mg b.i.d. 16. Myfortic 360 mg p.o. b.i.d. 17. Protonix 40 mg once a day. Followup appointment with the PCP and with Dr. _%#NAME#%_ in a couple of weeks in clinic and he is to be followed by his coordinator and labs Monday, Wednesday and Friday for PT/INR keep it between 2 and 3 for Coumadin a total of 3 months and his labs we will watch on Monday, Wednesday and Friday until his creatinine normalizes."
PCP,phencyclidine,"CT of the head showed no acute bleed. Alcohol level is nondetectable. Myoglobin is 520, U-Tox shows cannabis, otherwise negative for tricyclic, PCP, cocaine, barbiturates, methamphetamine and amphetamine. Next, acetaminophen and salicylate level are negative. Glucose is 135, potassium is 4.1, creatinine is 1.7, NI gap is 30."
PCP,UNSURED SENSE,"Scaled scores between 9 and 11 ar4e considered average. _%#NAME#%_'s ability to recall verbal information presented in the context of short stories was age-appropriate, both immediately (SS = 11) and after a longer delay (SS = 11). His ability to learn a discreet word list (16 words) over 4 consecutive trials was also average. After immediate exposure (SS = 9) and again after a longer delay (SS = 9). _%#NAME#%_'s visual memory skills were assessed using a subtest entitled Picture Memory, in which he was shown pictures of everyday scenes and then shown a similar picture and asked to mark any changes between the pictures."
CVA,cerebrovascular accident,PAST MEDICAL HISTORY: Significant for the following: 1. Hypertension. 2. Hyperlipidemia. 3. History of atrial fibrillation. 4. History of CVA with complete resolution. 5. Left carotid artery stenosis 70%. 6. History of right thigh hematoma with drainage surgery a few months ago.
CVA,costovertebral angle,"The ABDOMINAL EXAM shows bowel sounds are present. The abdomen is soft and nontender. No mass or hepatosplenomegaly noted. No hernia is noted. The BACK exam shows no CVA tenderness. EXTREMITIES show full range of motion. No bone, joint, or soft tissue abnormalities are apparent. NEUROLOGIC exam shows poor memory, otherwise no problems noted there."
PAC,(drug) PAC,She was on multiple medications on admission 1. Diflucan 2. Aldactone 3. Risperdal 4. Lactulose 5. Slo-Mag 6. Tequin 7. She also takes Aldactone 8. Entex PAC one tablet Q day She STATES THAT She IS ALLERGIC TO PENICILLIN AND CEPHALOSPORINS.
PAC,premature atrial contraction,"Lipids on _%#DDMM2007#%_, total cholesterol 188, triglycerides 101, HDL 48, LDL 120, AST 20. EKG shows normal sinus rhythm, rate of 66, 1 PAC, LAD, otherwise unremarkable. Troponin less than 0.04. Head CT negative. IMPRESSION: Syncope. The patient without any symptoms."
PAC,pulmonary artery catheter,"10. Obesity with history of fatty liver. 11. Iron deficiency first diagnosed in _%#MM2002#%_, treated with oral iron supplements which the patient has been taking since diagnosis. HOSPITAL COURSE: PROBLEM #1. Hypotension: The patient had a PAC placed which showed a septic-like picture; however, blood cultures were negative. She was placed on several days of Cipro and Zosyn as empiric therapy."
PAC,physician assistant certification,"PRE-OPERATIVE DIAGNOSIS: Morbid obesity. POST-OPERATIVE DIAGNOSIS: Morbid obesity. PROCEDURE: Laparoscopic gastric bypass and incidental cholecystectomy. SURGEON: _%#NAME#%_ _%#NAME#%_, MD ASSISTANT: _%#NAME#%_ _%#NAME#%_, PAC Admission BMI: 44.4. Weight: 275.3 Height: 5 foot 6 inches HOSPITAL COURSE: _%#NAME#%_ _%#NAME#%_ underwent gastric bypass and incidental cholecystectomy under general anesthesia uncomplicated."
PAC,post anesthesia care,"However, upon extubation, the patient was noted to be unresponsive and had difficulty breathing and therefore had to be reintubated. However, after re- extubation, the patient was able to wake up and the rest of the stay at PAC was uneventful. Postoperatively there was noted intact motor and sensory function of the left lower extremity. The drain was pulled out several hours after the procedure."
PAC,pulmonary arterial concentration,"The patient has hypoventilation and respiratory acidosis. Likely has obstructive sleep apnea, possibly a component of central sleep apnea, however, the CO2 retention in general, patients with central apnea from heart failure may have low PAC O2s. The patient is at risk for aspiration. the patient should be on BiPAP with a backup rate. If she cannot be managed on this she will need intubation discussed with her husband."
PAC,picture archiving communication,"IMAGING: A head CT done without contrast today _%#DDMM2007#%_ in comparison to a head CT done without contrast on _%#DDMM2007#%_, both of which were done at our institution and are in her PAC system shows: 1. Slight involution in the right temporal intraparenchymal hemorrhage. 2. A new 1.5x1.4 intraparenchymal hemorrhage in the right posterior occipital pole."
PAC,patient-controlled analgesia:PCA,"At this point and time, please see orders for details. We will place her on Rocephin 2 gm every 12 hours until cultures are back as well as Solu- Medrol. PAC pump for anesthesia. Tylenol as needed. Nicoderm patch for smoking. Heating pad for comfort. Trazodone for sleep. Celexa for anxiety."
PAC,UNSURED SENSE,"Scaled scores between 9 and 11 ar4e considered average. _%#NAME#%_'s ability to recall verbal information presented in the context of short stories was age-appropriate, both immediately (SS = 11) and after a longer delay (SS = 11). His ability to learn a discreet word list (16 words) over 4 consecutive trials was also average. After immediate exposure (SS = 9) and again after a longer delay (SS = 9). _%#NAME#%_'s visual memory skills were assessed using a subtest entitled Picture Memory, in which he was shown pictures of everyday scenes and then shown a similar picture and asked to mark any changes between the pictures."
PAC,prostate-specific antigen:PSA,"PAST MEDICAL HISTORY: 1. Non-small cell lung cancer as outlined above. 2. Prostate cancer, status-post prostatectomy in 1995, with slowly rising PAC as above. 3. Chemotherapy related anemia and anemic of chronic disease. SOCIAL HISTORY: He is married and lives with his wife."
SS,single strength,5. Itraconazole 100 mg p.o. each day 6. Ciprofloxacin 500 mg q.2 h. 7. Flagyl 500 mg q.6 h. 8. Bactrim SS 1x each day 9. Nystatin powder for pressure sores b.i.d. 10. Detrol 1 mg b.i.d. 11. Azithromycin 1200 mg q. week. 12. Factor VIII bolus 3000 units each day.
SS,sickle cell genotype SS,"REASON FOR ADMISSION: Chest pain, sickle cell crisis. OPERATIONS/PROCEDURES PERFORMED: CT angio performed on _%#MM#%_ _%#DD#%_, 2003, was negative for pulmonary embolism. HISTORY OF PRESENT ILLNESS: This is a 34-year-old female with a history of sickle cell anemia genotype SS, who has had frequent hospitalizations for sickle cell crises admitted from the emergency department on _%#MM#%_ _%#DD#%_, 2003, because of shortness of breath, achy arms, and hip pain, along with chest pain that is similar in nature to previous sickle cell crises per record and per patient."
SS,UNSURED SENSE,"Scaled scores between 9 and 11 ar4e considered average. _%#NAME#%_'s ability to recall verbal information presented in the context of short stories was age-appropriate, both immediately (SS = 11) and after a longer delay (SS = 11). His ability to learn a discreet word list (16 words) over 4 consecutive trials was also average. After immediate exposure (SS = 9) and again after a longer delay (SS = 9). _%#NAME#%_'s visual memory skills were assessed using a subtest entitled Picture Memory, in which he was shown pictures of everyday scenes and then shown a similar picture and asked to mark any changes between the pictures."
AVR,auditory brainstem response:ABR,"Preliminary report is 46 XY, high resolution analysis is still pending. 8) He did have an AVR hearing screening test which he passed. He received no immunizations during hospitalization. The patient was transferred to Fairview Ridges on _%#MMDD2002#%_ at which point he worked on his feedings."
AVR,aortic valve resistance,"She is currently intubated but alert. Nurses note issues of low urine output. PAST MEDICAL HISTORY: Diverticulitis as described above, chronic renal failure with baseline creatinine about 1.3 to 1.4, Alzheimer's dementia, aortic stenosis with an estimated AVR of 0.9 cm, anxiety disorder with depression, irritable bowel syndrome, hypertension, bilateral cataract extractions, bilateral knee replacements, hysterectomy with lysis of adhesions, osteoarthritis."
